120,맞다,맞다,답이 틀리지 않은 거예요.,퀴즈의 답을 맞혀서 칭찬을 받았어요.,문제를 풀어 보니 내 답이 맞았어요.,짝꿍이 정답을 맞혀서 기뻐했어요.,미사용,"관점, 재구성, 배경, 창의적, 분류, 기준",정답:맞다 | 보기:맞/다/가/나/라,"chunks:지수는/도서관에서/'맞다' 뜻을/배웠다. | targetIndex:2 | vocabDistractor:'관점' 뜻을 | hints:누가?/언제/어디서?/무엇을?/어찌했나? | fullDistractors:'맞다' 뜻이,혼자 놀았다.",초안,초안,N,OK | https://krdict.korean.go.kr/kor/dicSearch/SearchView?ParaWordNo=66231
121,의견,의견,어떤 것에 대한 나의 생각이에요.,학급 회의에서 자기 의견을 발표했어요.,친구와 서로 의견을 나눴어요.,나와 다른 의견도 잘 들어야 해요.,미사용,"나누다, 묶다, 표면, 확대, 대상, 작성",정답:의견 | 보기:의/견/가/나/다,"chunks:나는/수업 시간에/의견을/배웠다. | targetIndex:2 | vocabDistractor:나누다를 | hints:누가?/언제/어디서?/무엇을?/어찌했나? | fullDistractors:의견이,잊어버렸다.",초안,초안,N,OK | https://krdict.korean.go.kr/kor/dicSearch/SearchView?ParaWordNo=71118
122,대비,대비,두 가지를 비교해 보는 거예요.,여름과 겨울을 대비해 보면 날씨가 아주 달라요.,작년 사진과 올해 사진을 대비해 보았어요.,밝은 색과 어두운 색을 대비해서 칠했어요.,미사용,"판단, 주제, 반면, 형태, 기준, 구성",정답:대비 | 보기:성/대/서/비/달,"chunks:우리는/교실에서/대비를/배웠다. | targetIndex:2 | vocabDistractor:판단을 | hints:누가?/언제/어디서?/무엇을?/어찌했나? | fullDistractors:대비가,대충 봤다.",초안,초안,Y,OK | https://krdict.korean.go.kr/kor/dicSearch/SearchView?ParaWordNo=56049 | AUTO_SELECTED_90_BALANCED
123,보고,보고,알아본 것을 다른 사람에게 알려 주는 거예요.,현장학습에서 본 것을 선생님께 보고했어요.,관찰한 내용을 모둠 친구들에게 보고했어요.,조사한 결과를 반 친구들에게 보고했어요.,미사용,"범위, 개요, 수단, 찬성, 결과, 도구",정답:보고 | 보기:징/작/보/차/고,"chunks:민수는/집에서/보고를/배웠다. | targetIndex:2 | vocabDistractor:범위를 | hints:누가?/언제/어디서?/무엇을?/어찌했나? | fullDistractors:보고가,틀리게 말했다.",초안,초안,Y,OK | https://krdict.korean.go.kr/kor/dicSearch/SearchView?ParaWordNo=59392 | AUTO_SELECTED_90_BALANCED
124,떠오르다,떠오르다,위로 올라가는 거예요. 또는 갑자기 생각이 나는 거예요.,아침에 해가 떠올랐어요.,좋은 생각이 갑자기 떠올랐어요.,풍선이 하늘로 떠올랐어요.,미사용,"불가능, 수단, 대부분, 정확히, 특징, 반면",정답:떠오르다 | 보기:떠/오/르/다/가,"chunks:지수는/도서관에서/'떠오르다' 뜻을/배웠다. | targetIndex:2 | vocabDistractor:'불가능' 뜻을 | hints:누가?/언제/어디서?/무엇을?/어찌했나? | fullDistractors:'떠오르다' 뜻이,혼자 놀았다.",초안,초안,N,OK | https://krdict.korean.go.kr/kor/dicSearch/SearchView?ParaWordNo=53785
125,제시,제시,생각이나 의견을 내놓는 거예요.,선생님이 새로운 과제를 제시해 주셨어요.,문제를 해결할 방법을 제시했어요.,모둠 활동의 규칙을 제시했어요.,미사용,"제출, 역할, 의미, 기준, 단순, 계획",정답:제시 | 보기:시/제/소/요/술,"chunks:나는/수업 시간에/제시를/배웠다. | targetIndex:2 | vocabDistractor:제출을 | hints:누가?/언제/어디서?/무엇을?/어찌했나? | fullDistractors:제시가,잊어버렸다.",초안,초안,Y,OK | https://krdict.korean.go.kr/kor/dicSearch/SearchView?ParaWordNo=31794 | AUTO_SELECTED_90_BALANCED
126,미래,미래,아직 오지 않은 앞으로의 시간이에요.,미래에는 무엇이 되고 싶은지 생각해 보았어요.,미래의 자동차는 하늘을 날 수도 있을 거예요.,미래를 위해 열심히 공부해요.,미사용,"자료, 정하다, 참여, 연구, 기술, 번갈다",정답:미래 | 보기:미/래/가/나/다,"chunks:우리는/교실에서/미래를/배웠다. | targetIndex:2 | vocabDistractor:자료를 | hints:누가?/언제/어디서?/무엇을?/어찌했나? | fullDistractors:미래가,대충 봤다.",초안,초안,N,OK | https://krdict.korean.go.kr/kor/dicSearch/SearchView?ParaWordNo=61518
127,발달,발달,점점 더 자라고 좋아지는 거예요.,운동을 하면 근육이 발달해요.,아기가 점점 발달해서 걸을 수 있게 됐어요.,매일 책을 읽으면 생각하는 힘이 발달해요.,미사용,"관찰, 주제, 표시, 의미, 상황, 내용",정답:발달 | 보기:발/달/가/나/다,"chunks:민수는/집에서/발달을/배웠다. | targetIndex:2 | vocabDistractor:관찰을 | hints:누가?/언제/어디서?/무엇을?/어찌했나? | fullDistractors:발달이,틀리게 말했다.",초안,초안,N,OK | https://krdict.korean.go.kr/kor/dicSearch/SearchView?ParaWordNo=69497
